{"$schema":"https://json-schema.org/draft/2020-12/schema","type":"object","additionalProperties":false,"required":["schema","section_id","group_id","run_id","review_ref","outcomes"],"properties":{"schema":{"const":"finding-validation-set/v1"},"section_id":{"enum":["S0","S1"]},"group_id":{"type":"string","minLength":1},"run_id":{"type":"string","minLength":1},"review_ref":{"$ref":"#/$defs/ref"},"outcomes":{"type":"array","items":{"type":"object","additionalProperties":false,"required":["finding_id","state"],"properties":{"finding_id":{"type":"string","minLength":1},"state":{"enum":["closed","defer","reject","needs-user","open"]}}}}},"$defs":{"ref":{"type":"object","additionalProperties":false,"required":["digest"],"properties":{"path":{"type":"string","minLength":1},"digest":{"type":"string","pattern":"^sha256:[0-9a-f]{64}$"}}}}}
