{"group_id":"bootstrap-and-shared-closure","outcomes":[{"finding_id":"S1-CSR-001","state":"closed"},{"finding_id":"S1-LIFE-001","state":"closed"},{"finding_id":"S1-LIFE-002","state":"closed"},{"finding_id":"S1-LIFE-003","state":"closed"},{"finding_id":"S1-A-BR-001","state":"closed"},{"finding_id":"S1-A-BR-002","state":"closed"},{"finding_id":"S1-A-BR-003","state":"closed"},{"finding_id":"S1-A-BR-004","state":"closed"},{"finding_id":"S1-SC-KERNEL-AUTHORITY-DISJOINT","state":"closed"},{"finding_id":"S1-SC-F5-STALE-ADVICE-ACCEPTED","state":"closed"},{"finding_id":"S1-SC-F4-DAG-BYPASS","state":"closed"},{"finding_id":"S1-SC-RESULT-EMPTY-VALID","state":"closed"},{"finding_id":"S1-SC-F8-INTEGRITY-ERROR-ESCAPES","state":"closed"},{"finding_id":"S1-C-UPSTREAM-OPEN-GROUP-ADAPTER-001","state":"closed"},{"finding_id":"S1-C-UPSTREAM-OPEN-GROUP-HISTORY-002","state":"closed"},{"finding_id":"S1-C-COMPAT-DOWNSTREAM-TEST-BINDING-001","state":"closed"},{"finding_id":"FV-S1D-001","state":"closed"},{"finding_id":"FV-S1D-002","state":"closed"},{"finding_id":"FV-S1D-003","state":"closed"},{"finding_id":"C-S1D-PF-001","state":"closed"},{"finding_id":"C-S1E-SCHEMA-001","state":"closed"},{"finding_id":"S1E-CLOSE-ROOT-001","state":"closed"},{"finding_id":"S1E-FINDING-HISTORY-001","state":"closed"},{"finding_id":"S1E-CLOSE-ROOT-002","state":"reject"},{"finding_id":"S1E-CLOSE-GRAPH-001","state":"defer"}],"review_ref":{"digest":"sha256:9e66e307f2632239598556c504abf56695b4a9518b87c087470f111dbc209820","path":"agent-workflows/evidence/sections/S1/review.json"},"run_id":"s1-source-close-2026-09-05","schema":"finding-validation-set/v1","section_id":"S1"}
