{"group_id":"contracts-and-schema","outcomes":[{"finding_id":"S0-W1-F001","state":"closed"},{"finding_id":"S0-W1-F002","state":"closed"},{"finding_id":"S0-W1-F003","state":"closed"},{"finding_id":"S0-W1-F004","state":"closed"},{"finding_id":"S0-W1-F005","state":"closed"},{"finding_id":"S0-W1-F006","state":"closed"},{"finding_id":"S0-W1-F007","state":"closed"},{"finding_id":"S0-W1-F008","state":"closed"},{"finding_id":"S0-C-F001","state":"closed"},{"finding_id":"S0-D-F001","state":"closed"},{"finding_id":"S0-E-F001","state":"closed"},{"finding_id":"S0-E-F002","state":"closed"},{"finding_id":"S0-E-F003","state":"closed"},{"finding_id":"S0-E-F004","state":"closed"}],"review_ref":{"digest":"sha256:abc37c4e16efd0ee2a296bb4571b6e488e86d3d7ac304f95303779fff6be3ce3","path":"agent-workflows/evidence/sections/S0/review.json"},"run_id":"s0-source-transition-2026-09-04","schema":"finding-validation-set/v1","section_id":"S0"}
